[
  {
    "id": "U01",
    "ambiguity_type": "客套拒绝",
    "context": "自由职业者追问合作排期",
    "transcript": [
      {
        "speaker": "用户",
        "text": "那下个月能开始吗？"
      },
      {
        "speaker": "客户",
        "text": "最近大家都挺忙的，后面有机会再合作。"
      },
      {
        "speaker": "用户",
        "text": "所以这次先不做？"
      },
      {
        "speaker": "客户",
        "text": "嗯，先这样吧。"
      }
    ],
    "expected_analysis": {
      "ambiguity_level": "high",
      "observable_facts": [
        "客户没有给出下个月的日期",
        "客户说‘后面有机会再合作’",
        "追问后客户只说‘先这样吧’"
      ],
      "primary_interpretation": {
        "statement": "当前更像是委婉结束这次合作，而不是单纯等待排期。",
        "confidence": "medium",
        "evidence": [
          "客户没有给出下个月的日期",
          "客户说‘后面有机会再合作’"
        ]
      },
      "alternative_interpretations": [
        {
          "statement": "也可能项目确实暂缓，客户还没有可承诺的时间。",
          "confidence": "low",
          "evidence": [
            "追问后客户只说‘先这样吧’"
          ],
          "distinguishing_signal": "客户是否愿意给出重新联系的明确时间"
        }
      ],
      "missing_information": [
        "客户是否愿意给出重新联系的明确时间",
        "项目是否已经取消或换了供应方"
      ],
      "verification_move": "我确认一下：这次项目是先暂停，还是已经不继续了？我好安排后面的档期。",
      "update_rule": "若客户给出具体重启时间并主动跟进，降低拒绝判断；若继续无日期、无条件地收口，提高拒绝判断。"
    },
    "must_not_conclude": [
      "客户一定讨厌用户",
      "客户已经永久拉黑用户"
    ],
    "test_mode": "static_fictional_evaluation",
    "scene_read": "我听下来，客户这几句话大概率是在婉拒这一次合作：你两次往具体时间上问，对方都只把话往‘以后’推。不过现在还不能直接理解成永久不合作，关键看对方愿不愿意给重启条件。",
    "voices": {
      "A": "说实话，你现在最不该做的就是继续替那句‘以后有机会’预留档期。我会把它按本次合作结束处理，不追着证明自己；对方以后真有项目，就让新的预算、日期和合同重新说话。",
      "B": "这话确实像在收口，你再追问反而容易把自己放到求合作的位置。我建议你体面地回一句：‘明白，那这次我先释放档期，后续项目确定后你再联系我。’话说完就停。",
      "C": "你看，现在缺的不是继续猜客户喜不喜欢你，而是一个能触发行动的节点。我会把项目状态改成关闭；只有对方带着明确时间、范围和预算回来，才重新进入你的工作计划。"
    }
  },
  {
    "id": "U02",
    "ambiguity_type": "答非所问",
    "context": "用户向主管确认晋升标准",
    "transcript": [
      {
        "speaker": "用户",
        "text": "您上次说季度末看晋升，现在具体看哪几项？"
      },
      {
        "speaker": "主管",
        "text": "年轻人别只盯着职位，先把事情做好。"
      },
      {
        "speaker": "用户",
        "text": "那是业绩还是团队反馈？"
      },
      {
        "speaker": "主管",
        "text": "公司不会亏待认真做事的人。"
      }
    ],
    "expected_analysis": {
      "ambiguity_level": "high",
      "observable_facts": [
        "用户两次询问具体标准",
        "主管两次都没有给指标或时间",
        "主管把问题转成态度评价"
      ],
      "primary_interpretation": {
        "statement": "主管正在回避形成可追踪的晋升承诺。",
        "confidence": "medium",
        "evidence": [
          "用户两次询问具体标准",
          "主管两次都没有给指标或时间"
        ]
      },
      "alternative_interpretations": [
        {
          "statement": "主管可能暂时没有拿到组织的正式标准，因而无法回答。",
          "confidence": "low",
          "evidence": [
            "主管把问题转成态度评价"
          ],
          "distinguishing_signal": "主管是否愿意把问题转给有决策权的人"
        }
      ],
      "missing_information": [
        "主管是否愿意把问题转给有决策权的人",
        "公司是否存在书面晋升流程"
      ],
      "verification_move": "我不要求您现在承诺结果，能否确认由谁、在什么时间给我三项可衡量的评估标准？",
      "update_rule": "若主管给出责任人、日期和指标，改判为信息未齐；若继续只谈态度，提高回避承诺的置信度。"
    },
    "must_not_conclude": [
      "主管一定在打压用户",
      "用户肯定不会晋升"
    ],
    "test_mode": "static_fictional_evaluation",
    "scene_read": "我听下来，你问的是晋升标准和时间，主管连续两次回答的却是态度。这更像在回避留下可追踪的承诺，但也可能是他自己还没有拿到正式口径。",
    "voices": {
      "A": "你看，别再拿额外付出去兑换一句‘不会亏待你’了，这句话对你的职业收益没有可兑现价值。我会要求责任人、指标和日期；三样都没有，就按没有晋升承诺安排自己的选择。",
      "B": "哎，这种话最容易让人继续卖力又不好追问。你可以顺着给台阶：‘我理解结果现在不能承诺，那麻烦您帮我确认评估人、评估时间和三项指标，我按这个准备。’",
      "C": "你卡的不是怎么表现得更努力，而是晋升这件事没有负责人和验收标准。我建议你把口头鼓励转成书面节点；如果主管仍不接，就去确认正式流程和真正的决策人。"
    }
  },
  {
    "id": "U03",
    "ambiguity_type": "反问施压",
    "context": "伴侣讨论周末安排",
    "transcript": [
      {
        "speaker": "用户",
        "text": "这周我想留半天处理自己的事。"
      },
      {
        "speaker": "伴侣",
        "text": "所以现在跟我待着都算耽误你了？"
      },
      {
        "speaker": "用户",
        "text": "我不是这个意思，我只说半天。"
      },
      {
        "speaker": "伴侣",
        "text": "你都这么说了，我还能说什么。"
      }
    ],
    "expected_analysis": {
      "ambiguity_level": "high",
      "observable_facts": [
        "用户提出保留半天",
        "伴侣把半天安排改写成‘待着都算耽误’",
        "用户澄清后伴侣没有回应具体时间"
      ],
      "primary_interpretation": {
        "statement": "伴侣用反问把具体安排转成感情证明，客观上增加了用户拒绝的成本。",
        "confidence": "medium",
        "evidence": [
          "用户提出保留半天",
          "伴侣把半天安排改写成‘待着都算耽误’"
        ]
      },
      "alternative_interpretations": [
        {
          "statement": "伴侣也可能因近期陪伴不足而真实受伤，只是表达方式不准确。",
          "confidence": "low",
          "evidence": [
            "用户澄清后伴侣没有回应具体时间"
          ],
          "distinguishing_signal": "近期是否多次取消共同安排"
        }
      ],
      "missing_information": [
        "近期是否多次取消共同安排",
        "伴侣能否在情绪缓和后讨论具体半天"
      ],
      "verification_move": "我听到你像是担心我不想陪你。我们先确认一下：周六上午各自安排、下午一起，可以吗？",
      "update_rule": "若对方能回到具体安排，降低施压判断；若持续要求用放弃个人安排证明感情，提高该判断。"
    },
    "must_not_conclude": [
      "伴侣一定是控制型人格",
      "一次反问就等于情感操控"
    ],
    "test_mode": "static_fictional_evaluation",
    "scene_read": "我听下来，你只提出留半天给自己，伴侣却把它放大成‘和我待着是在耽误你’。这句话确实给了你感情压力，但也要看看近期是不是积累了陪伴不足，不能只凭一次反问就给关系定性。",
    "voices": {
      "A": "不是，你要半天个人时间不等于亏欠感情，没必要用放弃自己的安排来买对方安心。我会守住这半天，同时看对方能不能接受一个具体替代；如果每次都要你牺牲才算爱，那才是长期成本问题。",
      "B": "我懂你现在一解释就像在自证不爱他。别顺着那个大帽子争，直接接住真正担心：‘我不是不想陪你，周六上午我处理自己的事，下午我们好好一起待着，可以吗？’",
      "C": "好，你们现在把两个问题混在一起了：半天怎么安排，以及对方为什么觉得被冷落。我会先把时间落下来，再单独谈陪伴感；如果具体方案能接受，就别继续升级成感情审判。"
    }
  },
  {
    "id": "U04",
    "ambiguity_type": "多人插话",
    "context": "家庭讨论父亲复查",
    "transcript": [
      {
        "speaker": "母亲",
        "text": "下周复查总得有人去。"
      },
      {
        "speaker": "姐姐",
        "text": "我月底真的走不开。"
      },
      {
        "speaker": "哥哥",
        "text": "上次不是她去的吗？"
      },
      {
        "speaker": "用户",
        "text": "我上次去了，但这次还没说不能去。"
      },
      {
        "speaker": "母亲",
        "text": "那就还是你吧，省得再商量。"
      }
    ],
    "expected_analysis": {
      "ambiguity_level": "high",
      "observable_facts": [
        "姐姐明确说月底走不开",
        "哥哥提到用户上次去过",
        "用户没有拒绝本次",
        "母亲据此直接定为用户"
      ],
      "primary_interpretation": {
        "statement": "家里把用户没有明确拒绝当成了默认同意。",
        "confidence": "medium",
        "evidence": [
          "姐姐明确说月底走不开",
          "哥哥提到用户上次去过"
        ]
      },
      "alternative_interpretations": [
        {
          "statement": "母亲也可能只是为了尽快确定安排，并未意识到用户仍在考虑。",
          "confidence": "low",
          "evidence": [
            "母亲据此直接定为用户"
          ],
          "distinguishing_signal": "用户本次是否真的有时间"
        }
      ],
      "missing_information": [
        "用户本次是否真的有时间",
        "其他人能否出钱购买陪诊服务"
      ],
      "verification_move": "先别把我算成已经答应：我今晚八点前确认时间；如果去不了，我们一起定替代人或费用，可以吗？",
      "update_rule": "若家人接受等待确认和替代方案，改判为协调习惯；若仍把沉默视为义务，提高默认转嫁判断。"
    },
    "must_not_conclude": [
      "哥哥明确要求用户去",
      "姐姐已经拒绝承担所有责任"
    ],
    "test_mode": "static_fictional_evaluation",
    "scene_read": "听到这里，家里已经把你的‘还没说不能去’顺手当成了‘那就你去’。不一定是谁故意算计你，更像是这个家一直用最省事的方式分配照护。",
    "voices": {
      "A": "你没拒绝不等于你已经签收任务，这个默认责任我不会让你稀里糊涂背上。先算你这次真实能不能去；不能去就让其他人出时间或出钱，别再把全家的成本压给最容易答应的人。",
      "B": "这种家庭场面别一上来吵谁更孝顺，越吵越没完。我建议你马上纠正：‘我还没答应，今晚八点前确认；如果我去不了，咱们一起定替代人和费用。’",
      "C": "你看，你们缺的不是临时再劝一个人，而是确认机制。我会把陪诊拆成时间、交通、费用和联络四项；谁没空就认领费用，不再用沉默自动生成负责人。"
    }
  },
  {
    "id": "U05",
    "ambiguity_type": "前后矛盾",
    "context": "同事协作交付",
    "transcript": [
      {
        "speaker": "同事",
        "text": "这个不急，你周五给我就行。"
      },
      {
        "speaker": "用户",
        "text": "好，我排到周四。"
      },
      {
        "speaker": "同事",
        "text": "不过老板下午可能会看，你有现成的就先发。"
      },
      {
        "speaker": "用户",
        "text": "那到底是今天还是周五？"
      },
      {
        "speaker": "同事",
        "text": "我也没说今天必须啊。"
      }
    ],
    "expected_analysis": {
      "ambiguity_level": "high",
      "observable_facts": [
        "同事先说周五交付",
        "随后说老板下午可能看",
        "被追问后否认今天必须"
      ],
      "primary_interpretation": {
        "statement": "同事同时保留了周五承诺和今天拿结果的期待，把优先级风险留给用户。",
        "confidence": "medium",
        "evidence": [
          "同事先说周五交付",
          "随后说老板下午可能看"
        ]
      },
      "alternative_interpretations": [
        {
          "statement": "也可能同事只是转达一个尚未确认的可能需求。",
          "confidence": "low",
          "evidence": [
            "被追问后否认今天必须"
          ],
          "distinguishing_signal": "老板是否真的要求下午查看"
        }
      ],
      "missing_information": [
        "老板是否真的要求下午查看",
        "今天不发是否会产生实际后果"
      ],
      "verification_move": "我按周五正式交付；如果老板确认今天要看，请你在两点前发一句明确优先级，我再调整，可以吗？",
      "update_rule": "若出现老板的明确请求，更新为临时加急；若始终只有‘可能’，保持周五承诺并降低加急权重。"
    },
    "must_not_conclude": [
      "同事已经明确下令今天交",
      "同事故意陷害用户"
    ],
    "test_mode": "static_fictional_evaluation",
    "scene_read": "我听下来，同事嘴上保留着周五交付，实际上又希望你为老板‘可能下午看’提前准备。这里未必是故意坑你，但优先级风险确实被模糊地推到了你手里。",
    "voices": {
      "A": "你别为了一个‘可能’打乱已经排好的工作，还最后自己承担延期。我会把周五当正式承诺；今天要插队，就让提出加急的人明确确认，并接受其他任务顺延的成本。",
      "B": "这事不用跟同事争他到底说没说‘必须’。你直接把话钉住：‘我按周五交；老板如果确认今天看，请你两点前发一句明确优先级，我收到后调整。’",
      "C": "你现在需要的不是猜老板会不会看，而是一个优先级触发条件。我建议你保留原计划，只有明确请求、责任人和截止时间同时出现，才把它升级为加急任务。"
    }
  },
  {
    "id": "U06",
    "ambiguity_type": "转写低置信度",
    "context": "门店售后录音出现关键错词",
    "transcript": [
      {
        "speaker": "顾客",
        "text": "这个费用之前说过吗？",
        "confidence": 0.96
      },
      {
        "speaker": "店员",
        "text": "我们是说可以退／不可以退。",
        "confidence": 0.42
      },
      {
        "speaker": "顾客",
        "text": "我没听清，你再说一遍。",
        "confidence": 0.98
      },
      {
        "speaker": "店员",
        "text": "我查一下系统。",
        "confidence": 0.95
      }
    ],
    "expected_analysis": {
      "ambiguity_level": "high",
      "observable_facts": [
        "关键片段在‘可以退／不可以退’处置信度为0.42",
        "顾客当场表示没听清",
        "店员没有重复结论而是去查系统"
      ],
      "primary_interpretation": {
        "statement": "当前无法从该片段确定店员承诺了可退款。",
        "confidence": "medium",
        "evidence": [
          "关键片段在‘可以退／不可以退’处置信度为0.42",
          "顾客当场表示没听清"
        ]
      },
      "alternative_interpretations": [